{
  "onestop_id": "o-gc3cg-josephfoley",
  "tags": {
    "agency_id": "593",
    "agency_lang": "EN"
  },
  "name": "Joseph Foley",
  "short_name": null,
  "website": "http://www.transportforireland.ie",
  "associated_feeds": [
    {
      "feed_onestop_id": "f-gc3f-josephfoley~michaeldonegan"
    }
  ]
}