{
  "onestop_id": "o-dr09-washingtoncountycommuter",
  "tags": {},
  "name": "Washington County Commuter",
  "short_name": null,
  "website": "http://www.washco-md.net/transit/",
  "associated_feeds": [
    {
      "feed_onestop_id": "f-dr09-washingtoncountycommuter",
      "gtfs_agency_id": "1"
    }
  ]
}