{
  "onestop_id": "o-r3gj-pictonbuslines",
  "tags": {
    "agency_id": "74",
    "agency_lang": "EN",
    "agency_phone": "131500"
  },
  "name": "Picton Buslines",
  "short_name": null,
  "website": "http://transportnsw.info",
  "associated_feeds": [
    {
      "feed_onestop_id": "f-r6-nswtrainlink~sydneytrains~buswayswesternsydney~interlinebus"
    }
  ]
}