{
  "onestop_id": "o-qskk-transhedland",
  "tags": {
    "agency_id": "27",
    "agency_lang": "en"
  },
  "name": "TransHedland",
  "short_name": null,
  "website": "http://www.pta.wa.gov.au/OurServices/RegionalTownBusServices/tabid/62/Default.aspx",
  "associated_feeds": [
    {
      "feed_onestop_id": "f-q-transperth~transalbany~transbunbury~transbusselton~transgera"
    }
  ]
}