{
  "onestop_id": "o-dhvk-manateecountyareatransit",
  "tags": {},
  "name": "Manatee County Area Transit",
  "short_name": null,
  "website": "http://www.mymanatee.org/home/government/departments/public-works/transit-paratransit.html",
  "associated_feeds": [
    {
      "feed_onestop_id": "f-dhvk-manatee~fl~us",
      "gtfs_agency_id": "140"
    }
  ]
}