{
  "onestop_id": "o-ud9d-esvil~reisidas",
  "tags": {
    "agency_id": "804",
    "agency_lang": "et",
    "agency_phone": "+372 6004353"
  },
  "name": "Esvil-Reisid",
  "short_name": null,
  "website": "http://www.peatus.ee",
  "associated_feeds": [
    {
      "feed_onestop_id": "f-ud-atkoliinidoÜ~aktsiaseltshansabussiliinid~kihnuveeteedas~väi"
    }
  ]
}