{
  "onestop_id": "o-djz4-charlestonarearegionaltransportationauthority",
  "tags": {
    "agency_id": "213"
  },
  "name": "Charleston Area Regional Transportation Authority",
  "short_name": "CARTA",
  "website": "http://www.ridecarta.com/",
  "associated_feeds": [
    {
      "feed_onestop_id": "f-djz4-carta~sc~us"
    }
  ]
}