{
  "onestop_id": "o-r1f9-adelaidemetroschoolservice~lightcitybuses",
  "tags": {},
  "name": "Adelaide Metro - Light-City Buses School Service",
  "short_name": null,
  "website": "http://adelaidemetro.com.au/Timetables-Maps/Special-Services/School-Services",
  "associated_feeds": [
    {
      "feed_onestop_id": "f-r1f-adelaidemetrocomau",
      "gtfs_agency_id": "71"
    }
  ]
}