{
  "onestop_id": "o-f25-agencemtropolitainedetransport",
  "tags": {
    "agency_id": "TRAINS",
    "agency_lang": "fr",
    "agency_fare_url": "https://www.amt.qc.ca/fr/titres-tarifs/titres-metropolitains"
  },
  "name": "Agence m√©tropolitaine de transport",
  "short_name": "AMT",
  "website": "http://www.amt.qc.ca/",
  "associated_feeds": [
    {
      "feed_onestop_id": "f-f25d-agencemtropolitainedetransportexpress",
      "gtfs_agency_id": "EXPRESS"
    },
    {
      "feed_onestop_id": "f-f25-agencemtropolitainedetransport",
      "gtfs_agency_id": "TRAINS"
    }
  ]
}