{
  "onestop_id": "o-gc0vy9-bereislandferries",
  "tags": {},
  "name": "Bere Island Ferries",
  "short_name": null,
  "website": "http://www.bereislandferries.com",
  "associated_feeds": [
    {
      "feed_onestop_id": "f-gc-donegalcoastalcruises~arranmorecar~passengerferryservice~ar",
      "gtfs_agency_id": "10009"
    }
  ]
}