{
  "onestop_id": "o-rckq-metrolink",
  "tags": {},
  "name": "Metrolink",
  "short_name": null,
  "website": "http://www.aucklandtransport.govt.nz",
  "associated_feeds": [
    {
      "feed_onestop_id": "f-rck-gowest~sealinkgroup~atairporter~atmetro~thepartybuscompany",
      "gtfs_agency_id": "NZBML"
    }
  ]
}