{
  "onestop_id": "o-ezw5f-tuvisa~euskotran",
  "tags": {
    "agency_id": "TuvisaTran"
  },
  "name": "Tuvisa-EuskoTran",
  "short_name": null,
  "website": "http://www.vitoria-gasteiz.org/we001/was/we001Action.do?idioma=es&aplicacion=wb021&tabla=contenido&uid=65c21a87_117e9336274__7fba",
  "associated_feeds": [
    {
      "feed_onestop_id": "f-ezw5f-tuvisa~euskotran"
    }
  ]
}