{
  "onestop_id": "o-u30u-de~mitteldeutscher~verkehrsbund",
  "tags": {
    "agency_id": "LVTRAM",
    "agency_lang": "de"
  },
  "name": "Mitteldeutscher Verkehrsbund",
  "short_name": "MDV",
  "website": "http://www.mdv.de",
  "associated_feeds": [
    {
      "feed_onestop_id": "f-u30u-de~leipziger~mitteldeutscher"
    }
  ]
}