{
  "onestop_id": "o-dpsc-detroitdepartmentoftransportation",
  "tags": {
    "us_ntd_id": "50119"
  },
  "name": "Detroit Department of Transportation",
  "short_name": "DDOT",
  "associated_feeds": [
    {
      "feed_onestop_id": "f-dpsc-detroitdepartmentoftransportation",
      "gtfs_agency_id": ""
    }
  ]
}