{
  "onestop_id": "o-u3h4-mpkautobusy",
  "tags": {},
  "name": "MPK Autobusy",
  "short_name": null,
  "website": "http://www.mpk.wroc.pl",
  "associated_feeds": [
    {
      "feed_onestop_id": "f-u3h4-mpkautobusy~mpktramwaje~dla~sevibussiechnice~dlawiszniama",
      "gtfs_agency_id": "2"
    }
  ]
}