{
  "onestop_id": "o-9q-easternsierratransitauthority",
  "tags": {
    "agency_id": "78",
    "agency_lang": "en",
    "agency_phone": "(800) 922-1930"
  },
  "name": "Eastern Sierra Transit Authority",
  "short_name": null,
  "website": "http://www.estransit.com/",
  "associated_feeds": [
    {
      "feed_onestop_id": "f-9q-easternsierra~ca~us"
    }
  ]
}