{
  "onestop_id": "o-rb6-hanmerconnections",
  "tags": {},
  "name": "Hanmer Connections",
  "short_name": null,
  "website": "https://www.intercity.co.nz/",
  "associated_feeds": [
    {
      "feed_onestop_id": "f-rb-atairporter380~manukauorangebus~tranzalpinerailway~abeltasm",
      "gtfs_agency_id": "HC"
    }
  ]
}