{
  "onestop_id": "o-rbsm-valleyflyer",
  "tags": {
    "agency_id": "VLYF",
    "agency_lang": "en",
    "agency_fare_url": "http://www.metlink.org.nz/tickets-and-fares/"
  },
  "name": "Valley Flyer",
  "short_name": null,
  "website": "http://www.metlink.org.nz",
  "associated_feeds": [
    {
      "feed_onestop_id": "f-rbs-gowellington~tranzitcoachlines~paraparaumutaxisltd~kapitic"
    }
  ]
}