{
  "onestop_id": "o-s-societàtrasportocerignola",
  "tags": {},
  "name": "Società Trasporto Cerignola",
  "short_name": "STC",
  "website": "http://www.comune.cerignola.fg.it/hh/index.php",
  "associated_feeds": [
    {
      "feed_onestop_id": "f-s-societàtrasportocerignola",
      "gtfs_agency_id": "STC"
    }
  ]
}