{
  "onestop_id": "o-dn5b-georgiatechtrolley~stingershuttles",
  "tags": {
    "agency_id": "GATECH"
  },
  "name": "Georgia Tech Trolley & Stinger Shuttles",
  "short_name": null,
  "website": "https://pts.gatech.edu/",
  "associated_feeds": [
    {
      "feed_onestop_id": "f-dn5b-georgiatechtrolley~stingershuttles"
    }
  ]
}