{
  "onestop_id": "o-gc-sercocaledoniansleeper",
  "tags": {
    "agency_id": "CS",
    "agency_lang": "en",
    "agency_phone": "0330 060 0500"
  },
  "name": "Caledonian Sleeper",
  "short_name": null,
  "website": "http://www.sleeper.scot/",
  "associated_feeds": [
    {
      "feed_onestop_id": "f-gc-arrivatrainswales~c2c~chilternrailways~crosscountry~eastcoa",
      "gtfs_agency_id": "CS"
    },
    {
      "feed_onestop_id": "f-gc-rail~delivery~group~planar~gtfs",
      "gtfs_agency_id": "CS"
    }
  ]
}