{
  "onestop_id": "o-drk5-cttransit~newhaven",
  "tags": {
    "us_ntd_id": "10055",
    "agency_lang": "en",
    "agency_phone": "203-624-0151"
  },
  "name": "CTTransit - New Haven",
  "short_name": null,
  "website": "http://www.cttransit.com",
  "associated_feeds": [
    {
      "feed_onestop_id": "f-drk-cttransit~hartford"
    }
  ]
}