{
  "onestop_id": "o-qe8f6-transcarnarvon",
  "tags": {
    "agency_id": "26",
    "agency_lang": "en"
  },
  "name": "TransCarnarvon",
  "short_name": null,
  "website": "http://www.pta.wa.gov.au/OurServices/RegionalTownBusServices/tabid/62/Default.aspx",
  "associated_feeds": [
    {
      "feed_onestop_id": "f-q-transperth~transalbany~transbunbury~transbusselton~transgera"
    }
  ]
}